{
    "$id": "https://githb.com/jtschichold/mm-cloud-services-miners/AWSIPRangesMiner.schema.json",
    "$schema": "http://json-schema.org/draft-07/schema#",
    "type": "array",
    "minItems": 1,
    "items": {
        "type": "object",
        "properties": {
            "endpoint": {
                "type": "string"
            },
            "service": {
                "type": "string"
            },
            "region": {
                "type": "string"
            },
            "network_border_group": {
                "type": "string"
            }
        },
        "required": ["endpoint", "service", "region", "network_border_group"]
    }
}