[
    {
        "endpoint": "3.5.140.0/22",
        "region": "ap-northeast-2",
        "service": "AMAZON",
        "network_border_group": "ap-northeast-2"
    },
    {
        "endpoint": "2a05:d07a:a000::/40",
        "region": "eu-south-1",
        "service": "AMAZON",
        "network_border_group": "eu-south-1"
    }
]